{
  "$schema": "../schemas/machine-v1.schema.json",
  "format": "drop7-machine-v1",
  "machineProfileId": "MACH-20260902T080517Z-dec42aab",
  "capturedAt": "2026-09-02T08:05:17Z",
  "operatingSystem": {
    "system": "Darwin",
    "release": "25.5.0",
    "version": "Darwin Kernel Version 25.5.0: Mon Apr 27 20:41:06 PDT 2026; root:xnu-12377.121.6~2/RELEASE_ARM64_T6030",
    "architecture": "arm64",
    "distribution": null,
    "container": null
  },
  "cpu": {
    "model": "Apple M3 Pro",
    "physicalCores": 12,
    "logicalCpus": 12,
    "affinityLogicalCpus": null,
    "numaNodes": null,
    "governor": null
  },
  "memory": {
    "totalBytes": 19327352832,
    "availableBytes": null,
    "swapTotalBytes": null,
    "pageSizeBytes": 16384
  },
  "limits": {
    "cgroupVersion": null,
    "memoryMaxBytes": null,
    "cpuQuota": null,
    "cpuAffinity": null
  },
  "gpu": {
    "devices": [],
    "rocmVersion": null,
    "hipVersion": null,
    "sharedSystemMemory": null,
    "detectionNotes": "rocminfo not found; PyTorch probe: exit 1: Traceback (most recent call last):\n  File \"<string>\", line 1, in <module>\n    import json, torch; print(json.dumps({'version':torch.__version__, 'hip':torch.version.hip, 'available':torch.cuda.is_available(), 'devices':[torch.cuda.get_device_name(i) for i in range(torch.cuda.device_count())]}))\n    ; Confirm integrated/shared-memory status from the exact detected hardware."
  },
  "toolchain": {
    "python": "Python 3.14.7",
    "node": "v24.19.0",
    "clang": "Apple clang version 21.0.0 (clang-2100.1.1.101)",
    "gcc": "Apple clang version 21.0.0 (clang-2100.1.1.101)",
    "make": "GNU Make 3.81",
    "cmake": null,
    "hipcc": null
  },
  "profilers": {
    "perf": false,
    "rocprofv3": false,
    "rocm-smi": false,
    "numactl": false
  },
  "notes": [
    "PyTorch unavailable or not importable"
  ]
}
